{
  "schema": "dailyfuel/map-places/1",
  "source": "GeoNames cities5000, places with a population of 5,000 or more",
  "source_url": "https://download.geonames.org/export/dump/cities5000.zip",
  "licence": "Creative Commons Attribution 4.0 International (CC BY 4.0)",
  "licence_url": "https://creativecommons.org/licenses/by/4.0/",
  "attribution": "Place names: GeoNames, CC BY 4.0",
  "attribution_url": "https://www.geonames.org",
  "fetched": "2026-09-24",
  "modified": "2026-09-16",
  "rule": "Places in the 50 states plus DC with a population, GeoNames feature codes PPL, PPLA, PPLA2, PPLA3, PPLA4, PPLA5, PPLC, PPLF, PPLG, PPLL, PPLS (not sections of a place such as Harlem): the 1,500 largest by population plus every state capital, with Washington for DC.",
  "top": 1500,
  "fields": [
    "name",
    "state",
    "lat",
    "lon"
  ],
  "precision": 2,
  "encoding": "places holds one column per field, one entry per place. Places are grouped by state in postal code order, largest first within a state. lat and lon are integers in units of 10^-precision degrees, delta encoded: add each entry to the value before it, starting from 0.",
  "counts": {
    "us_rows": 7557,
    "eligible": 7110,
    "places": 1504,
    "top": 1500,
    "capitals_added": 4,
    "capitals": 51
  },
  "places": {
    "name": ["Anchorage","Fairbanks","Juneau","Huntsville","Birmingham","Montgomery","Mobile","Tuscaloosa","Hoover","Dothan","Auburn","Decatur","Madison","Florence","Phenix City","Gadsden","East Florence","Prattville","Vestavia Hills","Alabaster","Little Rock","Fort Smith","Fayetteville","Springdale","Jonesboro","North Little Rock","Conway","Rogers","Pine Bluff","Bentonville","Hot Springs","Benton","Phoenix","Tucson","Mesa","Chandler","Gilbert","Glendale","Scottsdale","Peoria","Tempe","Tempe Junction","Surprise","Yuma","San Tan Valley","Avondale","Goodyear","Flagstaff","Casas Adobes","Lake Havasu City","Casa Grande","Buckeye","Catalina Foothills","Maricopa","Oro Valley","Sierra Vista","Prescott Valley","Prescott","Marana","Bullhead City","Apache Junction","Sun City","Queen Creek","El Mirage","San Luis","Florence","Los Angeles","San Diego","San Jose","San Francisco","Fresno","Sacramento","Long Beach","Oakland","Bakersfield","Anaheim","Riverside","Santa Ana","Stockton","Chula Vista","Irvine","Fremont","San Bernardino","Fontana","Modesto","Oxnard","Moreno Valley","Huntington Beach","Glendale","Santa Clarita","Santa Rosa","Oceanside","Garden Grove","Rancho Cucamonga","Ontario","Elk Grove","Corona","Lancaster","Palmdale","Hayward","Salinas","Sunnyvale","Pomona","Escondido","Valencia","Torrance","Pasadena","Orange","Fullerton","Roseville","Visalia","Thousand Oaks","Concord","Simi Valley","East Los Angeles","Santa Clara","Victorville","Vallejo","Chico","Berkeley","El Monte","Carlsbad","Downey","Costa Mesa","Fairfield","Inglewood","Antioch","Temecula","Murrieta","Richmond","West Covina","Norwalk","Daly City","Burbank","Santa Maria","Clovis","El Cajon","San Mateo","Rialto","Vista","Compton","Mission Viejo","Vacaville","Ventura","South Gate","Hesperia","Carson","Santa Monica","San Marcos","Arden-Arcade","Westminster","Santa Barbara","Redding","San Leandro","Hawthorne","Livermore","Indio","Whittier","Menifee","Newport Beach","Tracy","Citrus Heights","Chino","Alhambra","Redwood City","Hemet","Buena Park","Lake Forest","Merced","Lakewood","Tustin","Mountain View","Napa","Pleasanton","Alameda","Bellflower","Chino Hills","Milpitas","Baldwin Park","Upland","Folsom","San Ramon","Manteca","Perris","Union City","Turlock","Apple Valley","Lynwood","Redlands","Rancho Cordova","Pittsburg","Walnut Creek","Redondo Beach","Yorba Linda","Davis","Camarillo","South San Francisco","Yuba City","Palo Alto","Laguna Niguel","San Clemente","Lodi","Santa Cruz","Pico Rivera","Madera","Montebello","Florence-Graham","Encinitas","Tulare","La Habra","Lake Elsinore","Carmichael","Monterey Park","Castro Valley","Rocklin","National City","Cupertino","Gardena","Petaluma","La Mesa","Huntington Park","San Rafael","Eastvale","Brentwood","Woodland","Arcadia","Santee","Dublin","South Whittier","Fountain Valley","Diamond Bar","Porterville","Hanford","Novato","Paramount","Rosemead","Highland","Colton","Hacienda Heights","Cathedral City","Watsonville","Yucaipa","Gilroy","Delano","West Sacramento","Placentia","Glendora","Palm Desert","Aliso Viejo","Poway","Cerritos","Lincoln","Azusa","La Mirada","Rancho Santa Margarita","Cypress","Rowland Heights","Covina","Ceres","Florin","Palm Springs","San Luis Obispo","San Jacinto","Antelope","Newark","Coachella","Danville","Lompoc","El Centro","Beaumont","San Bruno","Bell Gardens","Morgan Hill","Altadena","Rancho Palos Verdes","North Highlands","Rohnert Park","El Dorado Hills","Brea","Campbell","La Puente","La Quinta","San Gabriel","Calexico","Oakley","Pacifica","Stanton","Montclair","Martinez","Monrovia","Hollister","Los Banos","San Juan Capistrano","Temple City","Claremont","Bell","Moorpark","Willowbrook","Manhattan Beach","Wildomar","Bayview-Hunters Point","Pleasant Hill","San Dimas","Rubidoux","Dana Point","La Presa","Orangevale","Foster City","Menlo Park","Lawndale","Adelanto","Foothill Farms","Seaside","Oildale","La Verne","Westmont","Laguna Hills","Saratoga","Banning","Goleta","Fair Oaks","Denver","Colorado Springs","Aurora","Fort Collins","Lakewood","Thornton","Westminster","Arvada","Centennial","Pueblo","Greeley","Boulder","Highlands Ranch","Longmont","Loveland","Broomfield","Grand Junction","Castle Rock","Commerce City","Parker","Littleton","Northglenn","Brighton","Dakota Ridge","Englewood","Security-Widefield","Windsor","Ken Caryl","Wheat Ridge","Bridgeport","New Haven","Stamford","North Stamford","Hartford","Waterbury","Norwalk","Danbury","East Norwalk","New Britain","West Hartford","Bristol","Meriden","Hamden","Fairfield","West Haven","Milford","Stratford","City of Milford (balance)","East Hartford","Middletown","Enfield","Southington","Shelton","Norwich","Trumbull","West Torrington","Torrington","Glastonbury","Naugatuck","Washington","Downtown DC","Columbia Heights","Mount Pleasant","Wilmington","Dover","Newark","Jacksonville","Miami","Tampa","Orlando","St. Petersburg","Hialeah","Tallahassee","Fort Lauderdale","Cape Coral","Pembroke Pines","Port Saint Lucie","Hollywood","Gainesville","Miramar","Coral Springs","West Palm Beach","Palm Bay","Clearwater","Miami Gardens","Pompano Beach","Lakeland","Brandon","Davie","Spring Hill","Boca Raton","Plantation","Miami Beach","Deltona","Lehigh Acres","Melbourne","Sunrise","Palm Coast","Largo","Homestead","Kendall","Deerfield Beach","Town 'n' Country","Alafaya","Doral","Fort Myers","Boynton Beach","Daytona Beach","Lauderhill","Riverview","Weston","Kissimmee","Delray Beach","Tamarac","Carol City","Jupiter","Wellington","North Miami","North Port","Pine Hills","Port Orange","Fountainebleau","Coconut Creek","Ocala","Sanford","Palm Harbor","Margate","Kendale Lakes","Tamiami","Sarasota","Bradenton","Port Charlotte","Allapattah","East Pensacola Heights","Pensacola","Little Havana","Poinciana","Palm Beach Gardens","Bonita Springs","Pinellas Park","The Villages","Coral Gables","The Hammocks","Flagami","Apopka","Country Club","Cutler Bay","Titusville","Fort Pierce","Oakland Park","Wesley Chapel","North Miami Beach","North Lauderdale","Ocoee","Altamonte Springs","University","Ormond Beach","Carrollwood Village","Winter Garden","Hallandale Beach","North Fort Myers","Princeton","The Acreage","Oviedo","Panama City","Winter Haven","Aventura","Royal Palm Beach","Lake Worth Beach","Plant City","South Miami Heights","Dunedin","Kendall West","Richmond West","Valrico","Ponte Vedra Beach","Cooper City","Egypt Lake-Leto","Saint Cloud","Lauderdale Lakes","Winter Springs","Merritt Island","West Little River","Riviera Beach","Carrollwood","Golden Glades","Greenacres City","Santa Rosa Beach","Clermont","Land O' Lakes","Dania Beach","Navarre","Miami Lakes","East Lake","Lakeside","Atlanta","Columbus","Savannah","Athens","South Fulton","Sandy Springs","Roswell","Macon","Johns Creek","Albany","Warner Robins","Alpharetta","Marietta","Smyrna","Valdosta","Brookhaven","Stonecrest","Dunwoody","Augusta","Peachtree Corners","Gainesville","Milton","Newnan","Mableton","Rome","Martinez","East Point","Peachtree City","Dalton","Kennesaw","Hinesville","Redan","Douglasville","Honolulu","East Honolulu","Pearl City","Makakilo / Kapolei / Honokai Hale","Hilo","Joint Base Pearl Harbor Hickam","Aliamanu / Salt Lakes / Foster Village","Kailua","Waipahu","ʻEwa Gentry-West Loch","Kaneohe","Makiki / Lower Punchbowl / Tantalus","Des Moines","Cedar Rapids","Davenport","Sioux City","Iowa City","Waterloo","Ames","West Des Moines","Council Bluffs","Dubuque","Ankeny","Urbandale","Cedar Falls","Marion","Bettendorf","Boise","Meridian","Nampa","Idaho Falls","Pocatello","Caldwell","Coeur d'Alene","Twin Falls","Lewiston","Lewiston Orchards","Chicago","Aurora","Rockford","Joliet","Naperville","Peoria","Springfield","North Peoria","Elgin","Waukegan","Champaign","Cicero","Bloomington","Arlington Heights","Evanston","Schaumburg","Bolingbrook","Decatur","Palatine","Skokie","Des Plaines","Orland Park","Tinley Park","Oak Lawn","Berwyn","Mount Prospect","Normal","Wheaton","Oak Park","Hoffman Estates","Downers Grove","Glenview","Elmhurst","Lombard","DeKalb","Moline","Plainfield","Urbana","Belleville","Bartlett","Buffalo Grove","Quincy","Streamwood","Crystal Lake","Carol Stream","Romeoville","Rock Island","Carpentersville","Hanover Park","Wheeling","Park Ridge","Addison","Calumet City","Glendale Heights","Oswego","Northbrook","Woodridge","Elk Grove Village","Pekin","St. Charles","Danville","Mundelein","Galesburg","Gurnee","Indianapolis","Fort Wayne","Evansville","South Bend","Carmel","Bloomington","Hammond","Gary","Fishers","Lafayette","Muncie","Terre Haute","Noblesville","Kokomo","Greenwood","Anderson","Elkhart","Mishawaka","Lawrence","Jeffersonville","Columbus","West Lafayette","Portage","Westfield","New Albany","Richmond","Merrillville","Goshen","Valparaiso","